{
  "schemaVersion": "1.2",
  "collectedAt": "2026-09-21T20:00:00Z",
  "performsMutation": false,
  "tenantId": "11111111-1111-4111-8111-111111111111",
  "account": "pilot@example.invalid",
  "release": "2026.8",
  "pilotGroup": { "id": "22222222-2222-4222-8222-222222222222", "displayName": "Santa pilot", "memberId": "55555555-5555-4555-8555-555555555555" },
  "pilotDevice": {
    "entraObjectId": "55555555-5555-4555-8555-555555555555",
    "aadDeviceId": "66666666-6666-4666-8666-666666666666",
    "managedDeviceId": "77777777-7777-4777-8777-777777777777",
    "deviceName": "Pilot-Mac",
    "serialNumber": "C00000000000",
    "operatingSystem": "macOS",
    "osVersion": "26.0",
    "complianceState": "compliant",
    "lastSyncDateTime": "2026-09-21T19:59:00Z",
    "configurationStates": [
      { "id": "33333333-3333-4333-8333-333333333331", "displayName": "Santa 2026.8 - system-extension", "state": "succeeded", "version": 1 },
      { "id": "33333333-3333-4333-8333-333333333332", "displayName": "Santa 2026.8 - tcc", "state": "succeeded", "version": 1 },
      { "id": "33333333-3333-4333-8333-333333333333", "displayName": "Santa 2026.8 - service-management", "state": "succeeded", "version": 1 },
      { "id": "33333333-3333-4333-8333-333333333334", "displayName": "Santa 2026.8 - configuration", "state": "succeeded", "version": 1 }
    ]
  },
  "profiles": [
    { "id": "system-extension", "required": true, "objectId": "33333333-3333-4333-8333-333333333331", "displayName": "Santa 2026.8 - system-extension", "description": "[azd-santa:2026.8:system-extension] Template-owned Intune profile.", "lastModifiedDateTime": "2026-09-21T19:40:00Z", "assignment": { "groupIds": ["22222222-2222-4222-8222-222222222222"], "exactPilotOnly": true }, "overview": { "successCount": 1, "errorCount": 0, "failedCount": 0, "pendingCount": 0, "notApplicableCount": 0 }, "deviceStatuses": [{ "id": "mock_33333333-3333-4333-8333-333333333331_77777777-7777-4777-8777-777777777777", "deviceDisplayName": "Pilot-Mac", "userName": "pilot@example.invalid", "status": "succeeded", "lastReportedDateTime": "2026-09-21T19:55:00Z" }] },
    { "id": "tcc", "required": true, "objectId": "33333333-3333-4333-8333-333333333332", "displayName": "Santa 2026.8 - tcc", "description": "[azd-santa:2026.8:tcc] Template-owned Intune profile.", "lastModifiedDateTime": "2026-09-21T19:40:00Z", "assignment": { "groupIds": ["22222222-2222-4222-8222-222222222222"], "exactPilotOnly": true }, "overview": { "successCount": 1, "errorCount": 0, "failedCount": 0, "pendingCount": 0, "notApplicableCount": 0 }, "deviceStatuses": [{ "id": "mock_33333333-3333-4333-8333-333333333332_77777777-7777-4777-8777-777777777777", "deviceDisplayName": "Pilot-Mac", "userName": "pilot@example.invalid", "status": "succeeded", "lastReportedDateTime": "2026-09-21T19:55:00Z" }] },
    { "id": "service-management", "required": true, "objectId": "33333333-3333-4333-8333-333333333333", "displayName": "Santa 2026.8 - service-management", "description": "[azd-santa:2026.8:service-management] Template-owned Intune profile.", "lastModifiedDateTime": "2026-09-21T19:40:00Z", "assignment": { "groupIds": ["22222222-2222-4222-8222-222222222222"], "exactPilotOnly": true }, "overview": { "successCount": 1, "errorCount": 0, "failedCount": 0, "pendingCount": 0, "notApplicableCount": 0 }, "deviceStatuses": [{ "id": "mock_33333333-3333-4333-8333-333333333333_77777777-7777-4777-8777-777777777777", "deviceDisplayName": "Pilot-Mac", "userName": "pilot@example.invalid", "status": "succeeded", "lastReportedDateTime": "2026-09-21T19:55:00Z" }] },
    { "id": "configuration", "required": true, "objectId": "33333333-3333-4333-8333-333333333334", "displayName": "Santa 2026.8 - configuration", "description": "[azd-santa:2026.8:configuration] Template-owned Intune profile.", "lastModifiedDateTime": "2026-09-21T19:40:00Z", "assignment": { "groupIds": ["22222222-2222-4222-8222-222222222222"], "exactPilotOnly": true }, "overview": { "successCount": 1, "errorCount": 0, "failedCount": 0, "pendingCount": 0, "notApplicableCount": 0 }, "deviceStatuses": [{ "id": "mock_33333333-3333-4333-8333-333333333334_77777777-7777-4777-8777-777777777777", "deviceDisplayName": "Pilot-Mac", "userName": "pilot@example.invalid", "status": "succeeded", "lastReportedDateTime": "2026-09-21T19:55:00Z" }] },
    { "id": "notifications", "required": false, "objectId": "33333333-3333-4333-8333-333333333335", "displayName": "Santa 2026.8 - notifications", "description": "[azd-santa:2026.8:notifications] Template-owned Intune profile.", "lastModifiedDateTime": "2026-09-21T19:40:00Z", "assignment": { "groupIds": ["22222222-2222-4222-8222-222222222222"], "exactPilotOnly": true }, "overview": { "successCount": 0, "errorCount": 0, "failedCount": 0, "pendingCount": 0, "notApplicableCount": 0 }, "deviceStatuses": [] }
  ],
  "summary": { "assignmentProven": true, "pilotDeviceBound": true, "pilotDeviceConfigurationStateCount": 4, "profileStatusRowCount": 4, "requiredProfilesDelivered": true, "deliveryReadiness": true, "failures": [] }
}
